dlga_ransom_broker_talk:ransom_broker_sell_prisoners|Então é melhor você pegar seu dinheiro. Eu tenho prisioneiros para vender.
dlga_ransom_broker_talk:ransom_broker_sell_prisoners_all|Quero vender todos os prisioneiros que trouxe para você.
dlga_ransom_broker_sell_prisoners_all:ransom_broker_sell_prisoners_all_2|Tem certeza?
dlga_ransom_broker_sell_prisoners_all_2:ransom_broker_sell_prisoners_2|Tenho certeza.
dlga_ransom_broker_sell_prisoners_all_2:ransom_broker_pretalk|Deixe-me pensar sobre isso.
dlga_ransom_broker_talk:ransom_broker_intro_2|Conte-me sobre o que você faz novamente.
dlga_ransom_broker_talk:ransom_broker_ransom_companion|Eu quero resgatar um de meus companheiros.
dlga_ransom_broker_ransom_companion:ransom_broker_ransom_companion_choose|Quem você quer resgatar?
dlga_ransom_broker_ransom_companion_choose:ransom_broker_ransom_companion_name_sum|{s4}
dlga_ransom_broker_ransom_companion_choose:ransom_broker_pretalk|Esquece.
dlga_ransom_broker_ransom_companion_name_sum:ransom_broker_ransom_companion_verify|Deixe-me verificar meu livro... Sim. Seu amigo está sendo preso na masmorra em {s7}. Que interessante! Lembro-me de ter ouvido dizer que os ratos lá fora são grandes - como mastins, é o que dizem... Agora, Para a soma muito razoável de {reg5} veados de prata, que inclui tanto o resgate como a minha comissão e despesas , podemos providenciar Para que possa mais uma vez gozar da sua liberdade. O que você me diz?
dlga_ransom_broker_ransom_companion_verify:ransom_broker_ransom_companion_accept|Aqui está o seu dinheiro.
dlga_ransom_broker_ransom_companion_verify:ransom_broker_ransom_companion_refuse|Eu não consigo pagar isso agora.
dlga_ransom_broker_ransom_companion_accept:ransom_broker_talk|Esplêndido! Em poucos dias, eu acho, você deve encontrar {s5} cavalgando para se juntar a você, piscando à luz do sol e sem dúvida muito grato! Existe alguma outra maneira em que eu possa ajudá-lo?
dlga_ransom_broker_ransom_companion_refuse:ransom_broker_talk|É claro, é claro... Não importa o que dizem sobre os ratos, a propósito - eu nunca vi um eu mesmo, por causa da escuridão negra. Enfim, tenho certeza que {s5} vai entender porque é importante para você controlar as despesas. Agora... deseja mais alguma coisa?
dlga_ransom_broker_talk:close_window|Não dessa vez, adeus.
dlga_ransom_broker_sell_prisoners:ransom_broker_sell_prisoners_2|Deixe me ver o que você tem...
dlga_ransom_broker_sell_prisoners_2:close_window|Eu ficarei aqui por alguns dias. Deixe-me saber caso precise de meus serviços.
dlga_start:tavern_traveler_talk|Saudações, amig{o/a}. Você parece o tipo de {homem/pessoa} que faria bem em me conhecer. Viajo muito por toda Westeros e Essos e mantenho sempre o ouvido atento. Posso fornecer informações que podem ser úteis. Por um pequeno preço, é claro.
dlga_start:tavern_traveler_lost_companion_thanks|Saudações, {playername}. Eu vi seu companheiro {s10} na taverna de {s11} alguns dias atrás. E penso que você gostaria de saber.
dlga_tavern_traveler_lost_companion_thanks:tavern_traveler_pretalk|Obrigado. Eu irei encontrar {reg3?ela:ele} lá.
dlga_tavern_traveler_lost_companion_thanks:tavern_traveler_pretalk.1|Obrigado, mas eu realmente não me importo.
dlga_start:tavern_traveler_talk.1|Saudações, {playername}.
dlga_tavern_traveler_pretalk:tavern_traveler_talk|Sim?
dlga_tavern_traveler_talk:tavern_traveler_tell_kingdoms|O que você pode me dizer sobre essa terra?
dlga_tavern_traveler_tell_kingdoms:tavern_traveler_tell_kingdoms_2|O Norte é dividido em muitos reinos que não conseguem viver em paz com seus vizinhos nem eliminá-los. Como resultado, comum há uma ruptura nas guerras amargas que assolam esta terra e drenam sua força vital. Bem, pelo menos este deve ser um bom lugar para ser um aventureiro como você. Com alguma sorte e habilidade, você pode fazer seu nome aqui mesmo, acumular uma fortuna talvez, ou ganhar grande poder. As oportunidades são infinitas, e assim são como recompensas, se você está disposto a arriscar sua vida por tais.
dlga_tavern_traveler_tell_kingdoms_2:tavern_traveler_tell_kingdoms_3|Conte-me mais sobre essas oportunidades
dlga_tavern_traveler_tell_kingdoms_2:close_window|Obrigado. Isso é tudo que eu preciso saber.
dlga_tavern_traveler_tell_kingdoms_3:tavern_traveler_tell_kingdoms_4|Bem, você provavelmente sabe tudo que eu poderia te contar já. Você parece estar indo muito bem.
dlga_tavern_traveler_tell_kingdoms_3:tavern_traveler_tell_kingdoms_4a|Os reinos pagarão um bom dinheiro para mercenários, se forem acoplados a uma guerra. Se você tem lutando, fale com um de seus senhores e provavelmente resultará em ser oferecido um contrato de mercenário. Melhores recompensas virão se você conseguir se tornar um vassalo para um rei. Um vassalo pode possuir aldeias, castelos e cidades com impostos e as rendas destes estados. Normalmente, somente os nobres do reino possuem terra deste modo, mas em tempo de guerra, um rei não hesitará em aceitar alguém que se destaque no campo de batalha como um vassalo e concederá o direito de possuir terras.
dlga_tavern_traveler_tell_kingdoms_4a:tavern_traveler_tell_kingdoms_4|Não é inédito que aventureiros renunciem totalmente a lealdade à um rei, declarem-se reis, e reivindiquem terras em seu próprio nome. Este é um caminho difícil, no entanto, como os grandes nobres da terra, com sua longa linhagem de ancestrais, não são suscetíveis a aceitar iniciados como seu monarca. Tais governantes precisariam ter muito cuidado em estabelecer seu direito de governar, ou seriam atacados de todos os lados.
dlga_tavern_traveler_tell_kingdoms_4:tavern_traveler_tell_kingdoms_5|Pode ser mais fácil para um aventureiro como você prometer apoio ao rival existente de um rei. Existem muitos desses pretendentes ao Norte - que nascem na certa família, que ficam em volta e criam problemas dizendo que têm uma melhor necessidade ao trono do que o rei atual. Se esses reivindicadores pudessem encontrar tipos, podem começar guerras civis e até mesmo substituir o rei algum dia.
dlga_tavern_traveler_tell_kingdoms_5:tavern_traveler_tell_kingdoms_6|Interessante. Onde eu posso encontrar esses reinvindicadores do trono?
dlga_tavern_traveler_tell_kingdoms_5:close_window|Eu acho que já ouvi o suficiente. Obrigado.
dlga_tavern_traveler_tell_kingdoms_6:tavern_traveler_pretalk|Uma vida de reclamante está em perigo em seu próprio país, é claro. Portanto, eles geralmente ficam em cortes rivais, apoiando e esperando alguém encontrar alguém disposto a defender sua causa. Eu geralmente ouço notícias sobre alguns deles, e posso ser capaz de dizer-lhe sua localização com alguma precisão. Mas é claro, gostaria de pedir algo por esse serviço.
dlga_tavern_traveler_talk:tavern_traveler_pretender_location|Quero saber onde se encontra um pretendente.
dlga_tavern_traveler_pretender_location:tavern_traveler_pretender_location_ask|De quem se trata?
dlga_tavern_traveler_pretender_location_ask:tavern_traveler_pretender_location_ask_2|{s11}
dlga_tavern_traveler_pretender_location_ask:tavern_traveler_pretalk|Esquece.
dlga_tavern_traveler_talk:conchobor_cred|Você é...
dlga_conchobor_cred:tavern_traveler_pretalk|.....
dlga_tavern_traveler_pretender_location_ask_2:tavern_traveler_pretender_location_ask_money|Eu posso revelar essa informação para você por um pequeno preço. Eu diria 30 veados de prata.
dlga_tavern_traveler_pretender_location_ask_money:tavern_traveler_pretender_location_tell|Tudo certo, aqui estão as trinta veados de prata.
dlga_tavern_traveler_pretender_location_ask_money:tavern_traveler_pretalk|Esquece.
dlga_tavern_traveler_pretender_location_tell:tavern_traveler_pretalk|{s15} está atualmente em {s11}.
dlga_tavern_traveler_talk:tavern_traveler_lord_location_money|Quero saber a localização de um senhor.
dlga_tavern_traveler_lord_location_money:tavern_traveler_lord_location_money_2|Posso revelar essa informação por um pequeno preço, digamos 200 veados de prata.
dlga_tavern_traveler_lord_location_money_2:tavern_traveler_lord_location|Tudo bem. Aqui estão 200 veados de prata.
dlga_tavern_traveler_lord_location_money_2:tavern_traveler_pretalk|Deixa pra lá.
dlga_tavern_traveler_lord_location:tavern_traveler_lord_faction|Bem, qual facção do senhor você quer saber?
dlga_tavern_traveler_lord_faction:tavern_traveler_lord|{s1}
dlga_tavern_traveler_lord:tavern_traveler_lord_2|Qual?
dlga_tavern_traveler_lord_2:tavern_traveler_lord_3|{s1}
dlga_tavern_traveler_lord_2:tavern_traveler_pretalk|Deixa pra lá.
dlga_tavern_traveler_lord_3:tavern_traveler_pretalk|{s1}
dlga_tavern_traveler_talk:tavern_traveler_bookseller_location|Estou procurando por um vendedor de livros...
dlga_tavern_traveler_bookseller_location:tavern_traveler_pretalk|Lamento mas eu não vi nenhum ultimamente.
dlga_tavern_traveler_bookseller_location:tavern_traveler_bookseller_location_ask_money|Eu posso ter cruzado meu caminho com um ou dois recentemente. Por 100 veados de prata, eu direi aonde foi.
dlga_tavern_traveler_bookseller_location_ask_money:tavern_traveler_bookseller_location_tell|Tudo bem. Aqui estão 100 veados de prata.
dlga_tavern_traveler_bookseller_location_ask_money:tavern_traveler_pretalk|Deixa pra lá.
dlga_tavern_traveler_bookseller_location_tell:tavern_traveler_pretalk|Você pode encontrá-los em {s11}.
dlga_tavern_traveler_talk:tavern_traveler_ransom_broker_location|Estou procurando por um corretor de resgates...
dlga_tavern_traveler_ransom_broker_location:tavern_traveler_pretalk|Lamento mas eu não vi nenhum ultimamente.
dlga_tavern_traveler_ransom_broker_location:tavern_traveler_ransom_broker_location_ask_money|Eu sei onde eles estão. Por 50 veados de prata, vou te dizer.
dlga_tavern_traveler_ransom_broker_location_ask_money:tavern_traveler_ransom_broker_location_tell|Tudo bem. Aqui estão 50 veados de prata.
dlga_tavern_traveler_ransom_broker_location_ask_money:tavern_traveler_pretalk|Deixa pra lá.
dlga_tavern_traveler_ransom_broker_location_tell:tavern_traveler_pretalk|Você pode encontrá-los em {s11}.
dlga_tavern_traveler_talk:tavern_traveler_companion_location|Eu estou procurando por um dos meus companheiros...
dlga_tavern_traveler_companion_location:tavern_traveler_companion_location_ask|Talvez eu possa te ajudar. Quem você está procurando?
dlga_tavern_traveler_companion_location_ask:tavern_traveler_companion_location_ask_2|{s11}
dlga_tavern_traveler_companion_location_ask:tavern_traveler_pretalk|Esquece.
dlga_tavern_traveler_companion_location_ask_2:tavern_traveler_companion_location_ask_money|Eu acho que sei onde {s15} está. Por 30 veados de prata, eu direi para você.
dlga_tavern_traveler_companion_location_ask_money:tavern_traveler_companion_location_tell|Tudo certo, aqui estão as trinta veados de prata.
dlga_tavern_traveler_companion_location_ask_money:tavern_traveler_pretalk|Esquece.
dlga_tavern_traveler_companion_location_tell:tavern_traveler_pretalk|{s15} está atualmente em {s11}. {s12}
dlga_tavern_traveler_talk:tavern_traveler_rumors|Sei que você viaja bastante. Poderia espalhar alguns rumores durante suas viajens?
dlga_tavern_traveler_rumors:tavern_traveler_rumors1|Hmm, tudo é possível, pelo preço certo, é claro. Que tipo de rumores tem em mente?
dlga_tavern_traveler_rumors1:tavern_traveler_rumors2|Eu gostaria que você espalhasse rumores sobre a falta de lealdade de um lorde.
dlga_tavern_traveler_rumors1:tavern_traveler_rumors2.1|Eu gostaria de que você espalhasse rumores sobre a leviandade de um lorde.
dlga_tavern_traveler_rumors1:tavern_traveler_rumors2.2|Eu apenas quero iniciar uma briga entre dois lordes.
dlga_tavern_traveler_rumors4:tavern_traveler_rumors5|Que lorde de {s32} você tem em mente?
dlga_tavern_traveler_rumors5:tavern_traveler_pretalk|Esqueça.
dlga_tavern_traveler_rumors6:tavern_traveler_rumors7a|Muito bem. Você quer espalhar rumores sobre {s31}?
dlga_tavern_traveler_rumors6:tavern_traveler_rumors7b|Muito bem. Qual é o segundo lorde da facção?
dlga_tavern_traveler_rumors7c:tavern_traveler_rumors7d|Que lorde de {s32} você tem em mente?
dlga_tavern_traveler_rumors7e:tavern_traveler_rumors7a|Muito bem. Você quer começar uma briga entre {s31} e {s35}?
dlga_tavern_traveler_rumors7a:tavern_traveler_rumors7aa|Sim, isso é exatamente o que eu quero que você faça ..
dlga_tavern_traveler_rumors7aa:tavern_traveler_pretalk|Muito bem. Eu tentarei semear alguns rumores como você deseja. Verifiquem em uma semana para ver se os rumores estão funcionando.
dlga_tavern_traveler_rumors7a:tavern_traveler_pretalk|Desculpe, eu não tenho dinheiro.
dlga_tavern_traveler_rumors7a:tavern_traveler_pretalk.1|Na verdade eu mudei de ideia.
dlga_start:tavern_traveler_answer|Saudações. Eles dizem que você é o tipo de {reg59?Mulher:homem} que está interessado em ouvir que eu viajo frequentemente para {s17}. Eu direi tudo que eu sei por meros 100 veados de prata.
dlga_tavern_traveler_answer:tavern_traveler_continue|Aqui as suas 100 veados de prata. Diga-me o que você sabe.
dlga_tavern_traveler_answer:close_window|Desculpe, amigo. Eu não estou interessado.
dlga_tavern_traveler_continue:close_window|Bem, é tudo o que posso dizer. Adeus.
dlga_tavern_traveler_talk:close_window|Adeus.
dlga_start:bookseller_talk|Bom dia, {reg59?madame:senhor}. Dará uma olhada em meus livros?
dlga_bookseller_talk:bookseller_buy|Sim. Mostre-me o que tem à venda.
dlga_bookseller_buy:book_trade_completed|Claro, {reg59?madame:senhor}.
dlga_book_trade_completed:bookseller_talk|Algo mais?
dlga_bookseller_talk:close_window|Nada. Obrigado.
dlga_start:qohor_buy|Olá {sor/senhora}. Talvez você queira comprar uma das melhores peças de aço em todos os reinos?
dlga_qohor_buy:close_window|Claro, deixe-me ver o que você tem.
dlga_qohor_buy:merchant_gossip|Diga-me. Do que as pessoas estão falando atualmente?
dlga_qohor_buy:qohor_buy_rock|Tenho um pouco de Aço Valiriano que me foi dado pelo Senhor Comandante da Patrulha da Noite. Você pode forjá-lo novamente para mim?
dlga_qohor_buy:qohor_buy_rock_fake|Tenho um pouco de aço valiriano, você poderia refazê-lo para mim?
dlga_qohor_buy_rock_fake:qohor_buy_rock_fake2|Haha, o que é isso? Algum tipo de piada? Isto é simplesmente um velho minério de ferro, seu idiota!
dlga_qohor_buy_rock_fake2:qohor_buy|....
dlga_qohor_buy:qohor_buy_sword_ready|Você tem minha espada pronta?.
dlga_qohor_buy_sword_ready:qohor_buy|Ah, sim, claro, aqui está {playername}.
dlga_qohor_buy_rock:qohor_buy_rock2|Hmm, deixe-me ver. Eu posso forjar uma lâmina de duas mãos para você. Vou precisar do aço e outros 50.000 veados. O que você disse?
dlga_qohor_buy_rock2:qohor_buy_rock3|Claro, parece justo.
dlga_qohor_buy_rock2:qohor_buy_no|Desculpe, isso é demais para mim.
dlga_qohor_buy_no:qohor_buy|É um pouco íngreme, mas você não encontrará ninguém que possa forjá-lo para você.
dlga_qohor_buy_rock3:qohor_buy|OK, Pronto. Volte e me veja em sete dias, eu devo ter concluído até então.
dlga_qohor_buy:herrero_buy|(Rumor) Ah, olá, ser. Será que essas lâminas finas incluem aço valiriano? Isso é algo que você pode forjar?
dlga_herrero_buy:close_window|Desculpe, amigo, mas minha arte é apenas para os homens de fama. Volte quando você fizer um nome para si próprio (600 de renome).
dlga_herrero_buy:herrero_trade|Mas é claro, {reg59?senhora:senhor}.
dlga_herrero_buy:close_window.1|Haha, não discutimos segredos comerciais com qualquer um meu amigo. Volte quando estivermos mais .. conhecidos.
dlga_herrero_trade:herrero_trade2|Claro. O que você poderia fazer por mim, sor?
dlga_herrero_trade:close_window|Na verdade, mudei de ideia.
dlga_herrero_trade2:herrero_choose|Bem, ainda tenho aço valiriano suficiente para forjar uma pequena lâmina.
dlga_herrero_trade2:herrero_choose.1|Bem, tenho aço valiriano suficiente para forjar duas lâminas pequenas ou uma lâmina grande. Qual você prefere?
dlga_herrero_choose:herrero_window|Eu gostaria da espada. Eu vou chamá-la de Widow Maker (13.000 veados de prata).
dlga_herrero_choose:herrero_window.1|A lança, por favor (8000 veados de prata).
dlga_herrero_choose:herrero_window.2|Eu gostaria do machado franco. É um símbolo de riqueza (11000 veados de prata).
dlga_herrero_choose:close_window|Nada. Obrigado.
dlga_qohor_buy:close_window.1|Não, obrigado, estou apenas navegando.
dlga_herrero_window:close_window|Boa sorte. Lembre-se do meu nome se precisar de outra coisa. Adeus.
dlga_start:quastuosa_talk|Olá, {reg59?milady:milorde} *ela sorri e olha provovantemente para você*, como posso servi-l{o/a}?
dlga_quastuosa_pretalk:quastuosa_talk|Estou ao seu serviço, {playername}.
dlga_quastuosa_talk:quastuosa_serve|Preciso aumentar a moral dos meus homens.
dlga_quastuosa_talk:quastuosa_serve2|Talvez possamos encontrar um quarto?
dlga_quastuosa_talk:close_window|Não estou interessad{o/a}. Adeus.
dlga_quastuosa_serve:quastuosa_serve3|Seus homens devem uma grande festa, com nossas meninas servindo o melhor hidromel, nossos melhores alimentos e bardos... Vai lhe custar 1500 veados de prata.
dlga_quastuosa_serve3:quastuosa_pretalk|Suponho que meus homens ganharam isso. Desta vez.
dlga_quastuosa_serve3:close_window|Infelizmente, minha senhora, seus encantos estão além do alcance da minha bolsa.
dlga_quastuosa_serve2:quastuosa_serve4|Agradável. Você gosta de mim, {reg59?Minha senhora:meu senhor}, Não é? Bem, para você, há um preço especial de apenas 100 moedas. Como um sinal da nossa "amizade"...
dlga_quastuosa_serve4:quastuosa_serve5|Ótimo, aqui, pegue essas moedas como um "presente".
dlga_quastuosa_serve4:close_window|Não, obrigado. Você está tentando me roubar.
dlga_quastuosa_serve5:quastuosa_pretalk|(O tempo passa e você esquece os rigores e a fadiga da jornada que demorou para o seu corpo e alma. Por algumas horas, sua armadura e espada, o medo de morrer em qualquer escaramuça, o castigo da chuva e do vento , e A poeira das estradas é empurrada sob um pequeno par de felicidades. Mas, no final, acaba muito cedo, quando seu "amigo" sai silenciosamente da sala.)
dlga_start:minstrel_1|Saudações para você, {reg59?most noble lady:most noble sir}.
dlga_minstrel_1:minstrel_job_description|O que é isso que você faz?
dlga_minstrel_1:minstrel_courtship_questions|Tenho algumas perguntas sobre o namoro nessas terras.
dlga_minstrel_1:minstrel_courtship_poem|Você pode me usar alguns poemas?
dlga_minstrel_courtship_poem:minstrel_courtship_poem_teach|Posso usar-lhe o conto de Eneas e Dido, da Eneida. É um poema alegórico que aprovação como Dido, a Rainha de Cartago, se apaixonou, sob a influência dos deuses, com o herói troiano Enéas. Quando lembrado por Júpiter, ele deixa seu amante para cumprir seu dever de fundar uma nova cidade, Dido comete suicídio, amaldiçoando Eneas e revogando a vingança em uma antecipação simbólica das guerras ferozes entre Cartago e Roma. Seu tema - de amor forte separado pelo destino e amaldiçoado pelo suicídio - é apreciado por algumas senhoras nobres, mas não por todas.
dlga_minstrel_courtship_poem:minstrel_courtship_poem_teach.1|Posso te ensinar a Viagem do Bran. Esta saga Goidelic pode ser interpretada de forma erótica ou profética. Bran, filho de Fedbal e sua expedição de vinte e um companheiros viajam para uma ilha distante de luxo e prazer. Ao retornar, ele descobre que as idades passaram, e ele e sua partida já passaram para o mito. Ele nunca mais pode tocar o solo de sua pátria e navegar de novo. Eu acredito que atrai mulheres de certo temperamento romântico, mas você corre o risco de escandalizar ou aborrecer os outros.
dlga_minstrel_courtship_poem:minstrel_courtship_poem_teach.2|Posso usar-lhe o trágico conto de Orfeu, filho de Morfeu e a musa Calliope. É uma história triste e poderosa. Ele viaja para o Submundo para trazer Euridyce, sua falecida esposa, mas não consegue obedecer a condição imposta por Hades e Perséfone. Ouça-me.
dlga_minstrel_courtship_poem:minstrel_courtship_poem_teach.3|Posso te ensinar uma saga de Beowulf. É um conto heróico, cheio de sangue e batalha. Beowulf, um herói dos Geats, luta contra três antagonistas poderosos:Grendel, um monstro horrível, que atacou os guerreiros do hidromel de Hrodgar, o rei dos dinamarqueses, a mãe de Grendel e um dragão terrível. Ouça-me.
dlga_minstrel_courtship_poem:minstrel_courtship_poem_teach.4|Posso usar-lhe a Aesopica, como famosas fábulas de Esopo. Os contos desse escravo e contador de histórias geralmente apresentam animais, e são cômicos, satirizando homem e animal e moral, por suas lições práticas sobre a vida. Preste-lhe atenção.
dlga_minstrel_courtship_poem_teach:minstrel_courtship_poem_teach_2|Para ensinar a você, eu precisarei de algumas horas do seu tempo - e, claro, uma pequena taxa para os meus serviços. Cerca de 300 veados de prata suficientes.
dlga_minstrel_courtship_poem:minstrel_pretalk|Eu acredito que você já conheça os poemas que eu estou melhor afiado para usar.
dlga_minstrel_courtship_poem_teach_2:minstrel_courtship_poem_teach_3|Sim - me ensine aquele.
dlga_minstrel_courtship_poem_teach_2:minstrel_pretalk|Deixa pra lá.
dlga_minstrel_courtship_poem_teach_3:minstrel_courtship_poem_teach_4|Muito bem - repita depois de mim:^ Mas cuidados ansiosos já se apoderaram da rainha. Ela alimentou dentro de suas veias uma chama invisível. O valor, os atos e o nascimento do herói inspiram a alma dela e amam o fogo secreto...
dlga_minstrel_courtship_poem_teach_3:minstrel_courtship_poem_teach_4.1|Muito bem - repita depois de mim:^ Há uma ilha distante, em torno da qual os cavalos marinhos reluzem. Um curso justo contra o aumento de inchaço branco. quatro pés sustentam. Uma delícia dos olhos, um alcance glorioso, ^ É a planície em que os anfitriões mantêm jogos ^ Coracle contesta contra a carruagem ^ No sul Mag Findargat...
dlga_minstrel_courtship_poem_teach_3:minstrel_courtship_poem_teach_4.2|Muito bem - repita depois de mim:^ A musa Calliope aborreceu a Morpheus, um filho chamado Orfeu. Quem praticou a menestrelsy e por suas canções moviam pedras e árvores. Quando sua esposa Eurídice morreu, mordida por uma cobra, desceu ao Hades, falou para trazê-la, e convenceu Hades a enviá-la com ele de volta à vida. O deus prometeu fazê-lo, se, no caminho, Orfeu não se virasse até que ele devesse ir à sua própria casa. ^ Mas ele Desobedeceu e se virou viu sua esposa; E ela voltou para o Submundo, se perdendo para sempre...
dlga_minstrel_courtship_poem_teach_3:minstrel_courtship_poem_teach_4.3|Muito bem - repita depois de mim:^ Lá, elogio da proeza das pessoas - reis ^ De dinamarqueses armados de lança, em dias prolongados, ouvimos, ea honra que os aeletais ganharam! ^ Oft Scyld, o Scefing, do esquadrão Inimigos, de muitas tribos, o banco de hidromassagem rasgou, impressionando os conde...
dlga_minstrel_courtship_poem_teach_3:minstrel_courtship_poem_teach_4.4|Muito bem - repita depois de mim:^ Um leão foi acordado do sono por um rato que atravessava o rosto dele. Ele levantando-se com raiva, o pegou e estava prestes a matá-lo, quando o rato implorou piedosamente, dizendo:^ se você para bom apenas Poupe minha vida, eu seria certo em reembolsar sua bondade. ^ O Leão riu e deixou-o ir...
dlga_minstrel_courtship_poem_teach_4:minstrel_learn_poem_continue|Mas os cuidados anciosos já tomaram a rainha...
dlga_minstrel_courtship_poem_teach_4:minstrel_learn_poem_continue.1|Há uma ilha distante...
dlga_minstrel_courtship_poem_teach_4:minstrel_learn_poem_continue.2|A musa Calliope levou a Morpheus um filho chamado Orfeu...
dlga_minstrel_courtship_poem_teach_4:minstrel_learn_poem_continue.3|'LO, elogio da proeza das pessoas - reis...'
dlga_minstrel_courtship_poem_teach_4:minstrel_learn_poem_continue.4|Um leão acordado do sono por um rato correndo pelo rosto...
dlga_minstrel_courtship_poem_teach_4:minstrel_courtship_poem_teach_reject|Pshaw... que tipo de doggerel é esse?
dlga_minstrel_courtship_poem_teach_reject:minstrel_pretalk|Muito bem. Se o poema não é do seu gosto, então guardar seu dinheiro. Somente, lembre-se:com os poetas e com os amantes, o que é importante não é o que o agrada, mas o que agrada ao seu público. Se você deseja aprender o poema, ainda estou disposto a usar.
dlga_minstrel_learn_poem_continue:close_window|Muito bom - mas há muitas estrofas para ir. Agora, ouça atentamente...
dlga_minstrel_1:minstrel_gossip|Você pode me dizer alguma coisa sobre as donzelas elegíveis neste reino?
dlga_minstrel_gossip:minstrel_gossip_select|Sobre quem você deseja saber?
dlga_minstrel_gossip_select:minstrel_gossip_maiden_selected_2|Apenas me diga o último pedaço de fofoca.
dlga_minstrel_gossip_select:minstrel_gossip_maiden_selected|{s10}
dlga_minstrel_gossip_select:minstrel_pretalk|Deixa pra lá.
dlga_minstrel_gossip_maiden_selected:minstrel_gossip_maiden_selected_2|{s16}
dlga_minstrel_gossip_maiden_selected_2:minstrel_postgossip|Ela é casada com você, é claro! Claramente, ninguém sonharia que faria qualquer coisa para engendrar fofocas.
dlga_minstrel_gossip_maiden_selected_2:minstrel_postgossip.1|{s12}.
dlga_minstrel_gossip_maiden_selected_2:minstrel_postgossip.2|{s12}.
dlga_minstrel_postgossip:minstrel_pretalk|Muito interessante - mas deixe-nos falar de outra coisa.
dlga_minstrel_postgossip:minstrel_gossip|Muito interessante - há mais notícias?
dlga_minstrel_postgossip:minstrel_duel_confirm|O que? Eu terei aquele rosto misto na minha espada.
dlga_minstrel_duel_confirm:minstrel_duel_confirm_2|Você quer dizer isso? {s11} Será honrado em lutar contra você, mas desafiar um senhor a duelar por uma mulher é visto como um pouco atordoado, mesmo nesta era guerreira.
dlga_minstrel_duel_confirm_2:minstrel_duel_issued|Sim - Pretendo forçar {s11} Renunciar ao seu processo {s12}
dlga_minstrel_duel_confirm_2:minstrel_pretalk|Não - Eu deixo minhas paixões fugir comigo, lá.
