dlga_supported_pretender_talk:supported_pretender_equip|{reg65?Minha senhora:Meu senhor}, me permitiria verificar seu equipamento?
dlga_supported_pretender_equip:supported_pretender_pretalk|Ok, está tudo aqui...
dlga_supported_pretender_talk:pretneder_view_char_requested|Se não for um incômodo, o que pode me dizer sobre suas habilidades?
dlga_pretneder_view_char_requested:supported_pretender_pretalk|Ok, ok.
dlga_supported_pretender_talk:supported_pretender_grant_fief|Te sugiro que decida quem obterá um feudo que agora não tem nenhum senhor.
dlga_supported_pretender_grant_fief:supported_pretender_grant_fief_select|Que feudo tem em mente?
dlga_supported_pretender_grant_fief_select:supported_pretender_grant_fief_choose_recipient|{s4}
dlga_supported_pretender_grant_fief_choose_recipient:center_captured_rebellion|E quem deve recebê-lo?
dlga_supported_pretender_grant_fief_select:supported_pretender_pretalk|Não importa.
dlga_supported_pretender_talk:close_window|Siga-me, {reg65?senhora:senhor}.
dlga_do_member_trade:member_talk|Algo mais?
dlga_member_pretalk:member_talk|Algo mais?
dlga_member_chat:member_talk|Sim, {s5}?
dlga_member_chat:member_talk.1|Sim, Sua Graça?
dlga_member_chat:member_talk.2|O que é, {playername}?
dlga_member_talk:qyburn_healing|Por favor, dê uma olhada em meus ferimentos.
dlga_qyburn_healing:member_talk|Estou muito ferido para cuidar de seus ferimentos.
dlga_member_talk:sylva_healing|Por favor, dê uma olhada em meus ferimentos.
dlga_sylva_healing:member_talk|Estou muito ferido para cuidar de seus ferimentos.
dlga_qyburn_healing:member_talk.1|Você precisa deixar suas feridas anteriores cicatrizarem antes que eu possa curá-lo novamente, {playername}.
dlga_sylva_healing:member_talk.1|Você precisa deixar suas feridas anteriores cicatrizarem antes que eu possa curá-lo novamente, {playername}.
dlga_qyburn_healing:healing_major_qyburn|{Meu senhor/Minha senhora}. Seus ferimentos são piores do que eu pensava. Gostaria que eu {o/a} curasse? Vai custar {reg1} veados pelo material.
dlga_qyburn_healing:healing_minor_qyburn|{Meu senhor/Minha senhora}. Parece que você tem um pequeno ferimento, gostaria que eu o curasse? Para você, isso custará {reg1} veados pelo material.
dlga_qyburn_healing:member_talk.2|Parece que você não tem ferimentos, {meu senhor/minha senhora}.
dlga_healing_major_qyburn:healing_major_yes_qyburn|Claro, vá em frente.
dlga_healing_major_qyburn:member_chat|Na verdade, mudei de ideia.
dlga_healing_major_qyburn:member_chat.1|Droga, parece que não posso pagar seus serviços.
dlga_healing_major_yes_qyburn:healing_major_qyburn_finished|Tudo bem, {meu senhor/minha senhora}. Tem certeza de que não quer um pouco de leite de papoula? A decisão é sua. Deixe-me dar uma olhada nessa ferida agora. Ah, você deveria ter me visitado antes... já está gangrenando. Mas não há razão para ficar alarmad{o/a}. Eu simplesmente tenho que cortar a carne podre. Agora respire fundo, {meu senhor/minha senhora}... ah, esse corte foi um pouco profundo! Eu deveria ter tomado mais cuidado ao cortar tão perto de uma artéria. Rápido, garoto, traga-me aquele alicate e aquele frasco ali. Vamos, isso é sério! {Meu senhor/Minha senhora}, pode me ouvir? Fique comigo! Rapaz, eu te disse para ser rápido... ah, pelos Sete, você acordou. Foi por pouco, {meu senhor/minha senhora}. Da próxima vez, você não deve esperar tanto antes de consultar um meistre.
dlga_healing_major_qyburn_finished:member_talk|Muito obrigado, meistre. Já me sinto melhor.
dlga_healing_minor_qyburn:healing_minor_yes_qyburn|Claro, vá em frente.
dlga_healing_minor_qyburn:member_chat|Na verdade, mudei de ideia.
dlga_healing_minor_qyburn:member_chat.1|Droga, parece que não posso pagar seus serviços.
dlga_healing_minor_yes_qyburn:healing_minor_qyburn_finished|Bem, então, deixe-me apenas lavar e curar essas feridas, na verdade nenhum desafio real, velho meistre Qyburn. Ah, aí está.
dlga_healing_minor_qyburn_finished:member_talk|Obrigado, meistre, já me sinto melhor.
dlga_sylva_healing:healing_major_sylva|{Meu senhor/Minha senhora}... vejo que te acertaram de jeito mais uma vez. Você realmente precisa usar melhor seu escudo e armadura ou logo irá precisar de um coveiro, não de mim. Esse ferimento parece bastante sério. Vai custar {reg1} veados para as ervas medicinais e pelos curativos.
dlga_sylva_healing:healing_minor_sylva|{Meu senhor/Minha senhora}. Isso nada mais é do que um arranhão, embora eu imagine que deva causar uma dor significativa. Acho que posso conseguir o necessário para um curativo por {reg1} veados.
dlga_sylva_healing:member_talk.2|Do que você está reclamando? Você nem mesmo está ferido {senhor/senhora}.
dlga_healing_major_sylva:healing_major_yes_sylva|Claro, vá em frente.
dlga_healing_major_sylva:member_chat|Na verdade, mudei de ideia.
dlga_healing_major_sylva:member_chat.1|Droga, parece que não posso pagar seus serviços.
dlga_healing_major_yes_sylva:healing_major_sylva_finished|Vamos começar o procedimento, {meu senhor/minha senhora}. Algum dia desses você realmente terá que me permitir anestesiar a dor. Aqui, morda este pedaço de madeira. Felizmente, você veio até mim a tempo, a infecção estava para começar. Vou ter que limpar a ferida, costurá-la e aplicar um pouco de pomada para acelerar a cicatrização. Isso provavelmente vai doer muito mais do que ferir, então pense em uma pessoa amada ou em um lugar feliz, {meu senhor/minha senhora}. Sempre me imagino ao lado da Mãe Roine quando estou com dor. Certamente parece que quem te fez isso foi excepcionalmente cruel. Duvido que algum dia eles consigam fazer isso com outra pessoa que conhece seu temperamento... Concentre-se, droga! Você vai ficar bem... está de volta conosco, {meu senhor/minha senhora}. Você desmaiou por apenas alguns momentos.
dlga_healing_major_sylva_finished:member_talk|Obrigado Sylva, me sinto muito melhor agora.
dlga_healing_minor_sylva:healing_minor_yes_sylva|Claro, vá em frente.
dlga_healing_minor_sylva:member_chat|Na verdade, mudei de ideia.
dlga_healing_minor_sylva:member_chat.1|Droga, parece que não posso pagar seus serviços.
dlga_healing_minor_yes_sylva:healing_minor_sylva_finished|Isso não levará muito tempo. Eu só queria que todas as suas feridas fossem tão fáceis de tratar.
dlga_healing_minor_sylva_finished:member_talk|Agh, posso me mexer muito melhor agora, obrigado Sylva.
dlga_member_talk:member_direct_campaign|Como Marechal, desejo que envie uma mensagem para os vassalos do reino.
dlga_member_talk:member_trade|Deixe-me ver seus equipamentos.
dlga_member_trade:do_member_equip_trade|Muito bem, está tudo aqui...
dlga_do_member_equip_trade:member_talk|Você roubou minha armadura, seu bastardo!
dlga_do_member_equip_trade:member_talk.1|Mais alguma coisa?
dlga_member_talk:view_member_char_requested|O que você pode me dizer sobre suas habilidades?
dlga_view_member_char_requested:do_member_view_char|Ok, deixe-me falar...
dlga_member_talk:com_seduce6|Você tenta seduzir...
dlga_com_seduce6:com_seduce6.1|({Sua parceira/Seu Parceiro} está esperando que você faça algo...)
dlga_com_seduce6.1:lady_seduce_flirt|Piscadela...
dlga_com_seduce6.1:lady_seduce_flirt.1|Contar uma piada.
dlga_com_seduce6.1:lady_seduce_flirt.2|Elogiar...
dlga_com_seduce6.1:lady_seduce_flirt.3|Beijar a mão.
dlga_com_seduce6.1:lady_seduce_flirt.4|Beijar a bochecha.
dlga_com_seduce6.1:lady_seduce_flirt.5|Beijar os lábios.
dlga_com_seduce6.1:lady_seduce_flirt.6|Flertar descaradamente.
dlga_com_seduce6.1:lady_seduce_flirt.7|Induzir as preliminares.
dlga_com_seduce6.1:member_question|Deixar pra lá.
dlga_lady_seduce_flirt:member_question|{s20}.
dlga_com_seduce6:member_question|Desculpe, não tenho tempo para esse tipo de jogo.
dlga_member_talk:com_regalo6|Itens de presente avaliados em 2000 veados de prata.
dlga_com_regalo6:member_question|Obrigado, honro os presentes que você me deu.
dlga_member_talk:member_separate|Temos que nos separar por um tempo.
dlga_member_separate:member_separate_confirm|Ah, então é assim? Bom, eu não vou ficarei esperando aqui. Eu irei às cidades em busca de um novo emprego, é isso que você quer?
dlga_member_separate:companion_quitting|Na verdade há algo que eu preciso falar.
dlga_member_separate_confirm:member_separate_yes|Sim. Nós temos que nos separar.
dlga_member_separate_confirm:do_member_trade|Não, prefiro ter você ao meu lado.
dlga_member_separate_yes:close_window|Bom, então eu estou partindo. Chame se precisar de mim.
dlga_member_talk:member_question|Eu quero te perguntar uma coisa.
dlga_member_talk:close_window|Não importa.
dlga_member_question:member_question_2|Ok, o que você quer me perguntar?
dlga_member_question_2:member_morale|Como você acha que estão as coisas no exército?
dlga_member_question_2:member_background_recap|Conte-me a sua história novamente.
dlga_member_question_2:member_kingsupport_1|Imagino que você sabe que eu quero ser {reg59?rainha:rei}.
dlga_member_question_2:member_intelgathering_1|Você tem algum contato que podemos usar a nosso favor?
dlga_member_question_2:member_improverels_1|Eu gostaria de melhorar meus métodos com algumas pessoas.
dlga_member_question_2:member_fief_grant_1|Você tem interesse em obter um feudo?
dlga_member_question_2:close_window|Não importa.
dlga_member_morale:do_member_trade|{s21}
dlga_member_background_recap:member_background_recap_2|{s5}
dlga_member_background_recap_2:member_background_recap_3|{s5}
dlga_member_background_recap_3:do_member_trade|Então, um pouco depois, eu me uni a você.
dlga_do_member_view_char:member_talk|Algo mais?
dlga_member_kingsupport_1:do_member_trade|Hmm... Sim. Eu ouvi.
dlga_member_kingsupport_1:member_kingsupport_1a|{s21}
dlga_member_kingsupport_1a:member_kingsupport_2|Então, apoiará minha causa?
dlga_member_kingsupport_1a:do_member_trade|Ok, vou manter isso em mente.
dlga_member_kingsupport_2:do_member_trade|Sim, {s21}. Além, tenho uma proposta que irá ajudá-lo a manter o trono. Mas você recentemente adicionou {s22} em uma missão parecida. Acho melhor esperar algumas semanas para não atrair muitas atenções sobre nós.
dlga_member_kingsupport_3a:member_kingsupport_4|Tudo bem, faça-o.
dlga_member_kingsupport_3a:do_member_trade|Pensando melhor, não precisa ir.
dlga_member_kingsupport_4:close_window|Então, adeus, {s21}, por pouco tempo.
dlga_member_improverels_1:member_improverels_2|Que tipo de pessoas você tem em mente?
dlga_member_improverels_2:do_member_trade|Bem, esqueça isso, talvez mais tarde nós falamos sobre isso.
dlga_member_improverels_3:close_window|Ok, eu vou viajar para lá e tentarei melhorar suas relações com {s4}, {s21}.
dlga_member_intelgathering_1:member_intelgathering_3|{s21}
dlga_member_intelgathering_3:member_intelgathering_3|Claro, quanto menos pessoas saberem disso, melhor. Se você quiser reunir informação, ou me tirar daqui, então não envie um menssageiro. Leve-me lá. Mesmo que isso signifique entrar furtivamente.
dlga_member_intelgathering_3:member_intelgathering_4|É uma idéia explêndida, faça-a.
dlga_member_intelgathering_3:do_member_trade|Está bem, mas por enquanto não vá.
dlga_member_intelgathering_4:close_window|Ótimo. Você deve estar preparado para relatar em uns cinco dias. Adeus, então, {s21}, por pouco tempo.
dlga_merchant_quest_4_start:close_window|Esses bastardos! Eles estão atacando qualquer um que pensem ser da Casa Stark! Corra, {seu tolo/sua tola}!
dlga_start:relative_saved_1a|Pare! Você trouxe muitos navios com você. Quem você é e o que quer?
dlga_relative_saved_1a:close_window|Sim. Eu disse a ele que iria te encontrar. Aconselho você a voltar para sua família o mais rápido possível... e ter cuidado na estrada.
dlga_start:bandit_leader_1a|Puta merda! Perdoe-me! Poupe minha vida! Deixe-me ir e eu vou embora daqui, para aprender um trabalho honesto. Você nunca mais vai ouvir falar de mim!
dlga_bandit_leader_1a:bandit_leader_1b|Eu pouparei sua vida, mas em troca quero informações. Você ou um de seus "colegas" sequestraram o irmão de um conhecedor da cidade. Diga-me onde vocês o escondem e dê-me sua palavra de que você irá parar de assaltar como pessoas que passam por aqui.
dlga_start:looter_leader_1|O que você quer?
dlga_looter_leader_1:looter_leader_2|Eu estava procurando. Diga-me onde estão os prisioneiros e eu te deixarei ir.
dlga_looter_leader_1:close_window|Nada. Te deixarei em paz.
dlga_looter_leader_2:looter_leader_3|Ah! Nós libertaremos os prisineiros somente se você pagar ou resgate. Você trouxe alguma moeda?
dlga_looter_leader_3:close_window|Não, mas eu trouxe aço.
dlga_bandit_leader_1b:close_window|Oh! Bendito seja, {reg59?Senhora:senhor}. Nós não ferimos o garoto. Nosso esconderijo fica perto de {s9}. Descreverei uma área em detalhes, para você achar facilmente...
dlga_start:rescue_prisoner_succeed_2|{playername}, você o salvou! Muito obrigado por ter salvado meu {s11}. Por favor, pegue isso como uma recompensa por sua nobre ação.
dlga_rescue_prisoner_succeed_2:lord_pretalk|É sempre uma honra servir você, {s65}.
dlga_start_up_quest_1_next:close_window|Você está bem? Bom... Vejo que você está viv{o/a}, mais ou menos. Não tenho certeza se podemos dizer o mesmo do outro. Um ladrão a menos que causa problemas em nossas ruas à noite, embora todo mundo saiba que não vai ser o último... Enfim, talvez você pode me ajudar com uma coisa. Vamos conversar lá dentro. Aqui fora não sabemos quem pode nos escutar.
dlga_start:merchant_quest_2a|Um magnífico trabalho. Você contratou homens suficientes para acabar com aqueles bandidos. E agora... os viajantes que passam por {s9} me falaram que há um punhado de ladrões andando pra lá e pra cá pelos arredores da cidade. Eu suspeito que sejam do mesmo bando que sequestrou meu irmão. Siga eles, mate-os e faça falarem onde está o meu irmão!
dlga_start:merchant_quest_3a|Então você já descobriu onde eles escondem meu irmão? Excelente trabalho. Às vezes me surpreende o quão bem eu julgo o caráter das pessoas, e você parece ser {reg59?Uma mulher:um homem} capaz de fazer as coisas direito. Agora vá e ache meu irmão!
dlga_start:merchant_quest_3b|Bom... Meu irmão está a salvo em casa. Não tenho certeza do que fazer com ele, talvez enviá-lo às Terras Nórdicas. Desse modo, se ele perde a cabeça em alguma briga de rua, ninguém pode me culpar. Mas isso não problema seu. Aqui está o resto da recompensa, você merece.
dlga_merchant_quest_3b:merchant_quest_4a|A recompensa é boa e eu fico feliz por ter ajudado.
dlga_merchant_quest_4a:merchant_quest_4b|Bom! Está interessado em fazer mais uma coisa?
dlga_merchant_quest_4b:merchant_quest_4b1|Talvez. O que você precisa?
dlga_merchant_quest_4b1:merchant_quest_4b2|Lembra que eu havia te dito que os bandidos tinham um aliado na cidade? Eu acho que sei quem é:o capitão da guarda, nada menos. Poucos meses atrás, esse capitão, ao ver o aumento de benefícios dos mercadores graças ao comércio estrangeiro, decidido algum dinheiro para financeiro uma viagem. Infelizmente, com muitos novatos neste negócio, eles ignoravam que grandes benefícios envolvem grandes riscos. Então, ele gastou todo seu dinheiro com itens de luxo e, claro, ele foi assaltado e perdeu tudo.
dlga_merchant_quest_4b2:merchant_quest_4b3|Consequentemente, nosso capitão virou um rufião para recuperar sua fortuna. Eu acho que eu faria o mesmo, mesmo se os céus não quiserem, a qualquer hora eu enfrento dívidas. Qualquer capitão da guarda geralmente tem alguns bandidos na folha de pagamento para que o informem do resto, mas nosso capitão, aparentemente, decidiu usar esses bastardos para tudo. Você fala alguma vez de um caçador cuidar de gado? Bem, nos Reinos do Norte os pastores às vezes se tornam caçadores. Felizmente, dentro da guarda ainda existem almas valentes e honestas que me falaram tudo.
dlga_merchant_quest_4b3:merchant_quest_4b4|Então, este é o meu plano. Eu poderia denunciar esta situação a {s4}, o lorde da cidade, mas isso significaria muitas perguntas, e seria minha palavra contra a do capitão. As testemunhas podem ser compradas, como provas destruídas, o caso cairia no esquecimento se o inimigo cruzar nossas fronteiras e tudo o que eu obteria pela dificuldade seria uma faca entre minhas costelas. Em tempos de guerra, como bem sabe, os olhos do rei voltam-se para terras distantes, e quem sofre são seus súditos. Então, tenho uma outra ideia. Eu tenho um pequeno grupo de plebeus, alguns homens a meu serviço, e alguns outros que perderam seus parentes nas mãos desses bandidos, e vamos buscar o capitão em sua própria casa e trazê-lo acorrentado.
dlga_merchant_quest_4b4:merchant_quest_4b5|Tudo o que preciso agora é que alguém lidere meu pequeno exército para a batalha, e eu não consigo pensar em ninguém melhor que você. Então, o que me diz?
dlga_merchant_quest_4b5:merchant_quest_4b6|Como sei que está me dizendo uma verdade?
dlga_merchant_quest_4b6:merchant_quest_4b7|Oh, bem, suponho que você pode encontrar uma dúzia de bandidos que está disposto a dar suas vidas por este fim. Acredito que você realmente não tem como saber se minha palavra é boa, mas acho que entendre que o meu dinheiro é bom... e há 100 veados de prata esperando por você, se me fazer este pequeno favor. O que você diz?
dlga_merchant_quest_4b7:merchant_quest_4b8|Perfeito. Eu liderarei seus homens.
dlga_merchant_quest_4b7:merchant_quest_4_decline|Sinto muito, mas isto está indo muito rápido. Eu preciso de algum tempo para pensar.
dlga_merchant_quest_4b8:merchant_quest_4b9|Ótimo. Fazia tempo que não embarcava em um negócio tão emocionante. Meus homens estão prontos para agir sob suas ordens. Está preparado?
dlga_merchant_quest_4b9:merchant_quest_4_accept|Sim. Dê-lhes o sinal.
dlga_merchant_quest_4b9:merchant_quest_4_decline|Agora não. Vou precisar descansar um pouco antes de lutar novamente.
dlga_merchant_quest_4_accept:close_window|Bom! Então, golpeie duro, golpeie rápido, e o capitão e seus seguidores não terá nem tempo de se perguntarem quem os atacou. Que Deus esteja com você!
dlga_merchant_quest_4_decline:close_window|Certo. Eu posso manter meus homens esperando. No entanto, se você perder muito tempo, acho que serei obrigado a terminar essa tarefa sem você, embora prefira contar com seus serviços. Agora, tomo o tempo que precisa.
dlga_merchant_quest_2a:close_window|Muito bem. Vamos caçar alguns bandidos.
dlga_merchant_quest_2a:merchant_quest_2a_whynotcome|Por que não vem conosco?
dlga_merchant_quest_2a_whynotcome:merchant_quest_2a|Porque eu estou pagando para apenas você se ocupar disto. Essa é uma resposta curta. A resposta longa é que tenho alguns assuntos aqui na cidade, e ao acompanhar eu várias possibilidades de acabar com a cabeça quebrada, se é o que você quer saber. Mas eu respeito sua pergunta. Então, o que me diz?
dlga_merchant_quest_2a:close_window.1|Não posso me encarregar deste assunto no momento.
dlga_merchant_quest_3a:close_window|Muito bem. Vou atacar os bandidos em seu próprio covil, e encontrar seu irmão.
dlga_merchant_quest_3a:close_window.1|Não posso me encarregar deste assunto no momento.
dlga_start:merchant_quest_persuasion12|Boa sorte, {sor/minha senhora}.
dlga_merchant_quest_3a:merchant_quest_persuasion|Você faz um caso convincente. Vou ajudá-lo.
dlga_merchant_quest_persuasion:merchant_quest_2|Você é um indivíduo convincente... você lhe ajudar.
dlga_merchant_quest_persuasion:merchant_quest_3|Você é um indivíduo convincente... você lhe ajudar.
dlga_merchant_quest_persuasion:merchant_quest_4b8|Você é um indivíduo convincente... você lhe ajudar.
dlga_merchant_quest_persuasion12:close_window|Obrigado. Até a próxima.
dlga_merchant_quest_2:merchant_quest_2a|Agora... vá encontrar e derrotar este grupo de bandidos.
dlga_merchant_quest_3:merchant_quest_3a|Agora... invada o covil esses bandidos, traga meu irmão de volta, e ensine a esses bastardos o que acontece com aqueles que ameaçam minha família.
dlga_start:close_window.46|Oh... louvados sejam os Sete... estou salvo?
dlga_start:merchant_closing_statement_2|Ah... {playername}. As coisas não correram tão bem como esperado. O {s5} não deixará passar minha pequena ruptura da paz em seus domínios. Oh, ele certamente será grato por eu ter me livrado de seu capitão desonesto, um guarda que deixa bandidos passarem também deixaria passar o exército inimigo se o preço fosse suficiente, mas não permitirá que eu continue vagando por aqui como um permanente lembrete de sua incapacidade para cuidar das coisas sozinho.
dlga_merchant_closing_statement_2:merchant_closing_statement_3|Isso não parece justo...
dlga_merchant_closing_statement_3:merchant_closing_statement_4|Justo? Isso são as Terras Nórdicas. Os reis fazem o que querem, e o resto de nós fazemos o que devemos. Sua majestade não me condenou a passar o resto da minha vida algemado em seus calabouços. Em vez disso me comprometer vender minhas propriedades, e inclusive ter influenciado os outros mercadores a comprarem meus bens por um preço justo. Isso é o suficiente amigável, considerando como muitas vezes os monarcas atuam quando são minimamente ameaçados. Mas Sua Alteza é um rei fraco, como todos os outros em Calradia, e a primeira coisa que os reis fracos sempre buscam e consolidar sua autoridade, mesmo relegando a justiça a um segundo plano. Imagino que eu faria a mesma coisa em seu lugar.
dlga_merchant_closing_statement_4:close_window|De qualquer forma, eu não iria sair difundindo por aí este assunto nas terras próprias do {s5}... embora certamente sua majestade já tenha tomado nota de suas ações, e decidido que não valia a pena puni-lo, o que já poderia ser motivo de comemoração... Além disso, ainda é possível que Sua Alteza Real pense em lhe confiar alguma tarefa, embora você também possa escolher sua espada para um dos seus concorrentes... Em todo o caso, espero que tenha aprendido um pouco sobre o que é preciso para se manter vivo nesta terra cheia de problemas, e também... espero que o dinheiro que ganhou não seja desperdiçado... Boa sorte.
dlga_merchant_quests_last_word:close_window|Estou me preparando para deixar a cidade o mais rápido possível. Foi uma honra conhecê-lo. Que a sorte esteja com você...
dlga_member_intel_liaison:member_intel_liaison_results|O que tem descoberto?
dlga_start:member_intel_liaison|Saudações, estranho.
dlga_member_intel_liaison:close_window|É hora de sairmos. Deixaremos a cidade normal, mas logo que possível nos reuniremos.
dlga_member_intel_liaison:close_window.1|Você está fazendo um ótimo trabalho. Fique aqui um pouco mais.
dlga_member_intel_liaison_results:member_intel_liaison|{s11}, enviarei o resto do meu relatório por escrito.
dlga_member_fief_grant_1:member_fief_grant_2|Que feudo você tem em mente?
dlga_member_fief_grant_2:member_fief_grant_3|{s11}
dlga_member_fief_grant_2:do_member_trade|Esqueça. Por enquanto eu não posso lhe oferecer nenhum feudo.
dlga_start:close_window.47|Partimos assim que você estiver pront{o/a}.
dlga_start:close_window.48|Por favor, não desperdice mais meu tempo hoje, {sor/senhora}. Talvez nos encontremos novamente em nossas viagens.
dlga_start:companion_recruit_intro_response|{s5}
dlga_companion_recruit_intro_response:companion_recruit_backstory_a|{s6}
dlga_companion_recruit_intro_response:close_window|{s7}
dlga_companion_recruit_backstory_a:companion_recruit_backstory_b|{s5}
dlga_companion_recruit_backstory_b:companion_recruit_backstory_c|{s5}
dlga_companion_recruit_backstory_c:companion_recruit_backstory_response|{s5}
dlga_companion_recruit_backstory_response:companion_recruit_signup|{s6}
dlga_companion_recruit_backstory_response:close_window|{s7}
dlga_companion_recruit_signup:companion_recruit_signup_b|{s5}
dlga_companion_recruit_signup_response:close_window|Infelizmente, eu não posso ter mais companheiros em meu grupo no momento.
dlga_companion_recruit_signup_response:companion_recruit_payment|{s6}
dlga_companion_recruit_signup_response:close_window.1|{s7}
dlga_companion_recruit_payment:companion_recruit_signup_confirm|.
dlga_companion_recruit_payment_response:companion_recruit_signup_confirm|{s6}
dlga_companion_recruit_payment_response:close_window|Desculpe. Não posso pagar por isto no momento.
dlga_start:companion_recruit_meet_again|Nos encontraremos novamente.
dlga_companion_recruit_meet_again:companion_recruit_backstory_delayed|Então... O que você tem feito desde nosso ultimo encontro?
dlga_companion_recruit_meet_again:close_window|Bom dia para você.
dlga_start:companion_recruit_secondchance|Sim?
dlga_companion_recruit_secondchance:companion_recruit_backstory_b|Desculpa se fui ruim mais cedo. Qual sua historia novamente?
dlga_companion_recruit_secondchance:close_window|Esqueça.
dlga_companion_recruit_backstory_delayed:companion_recruit_backstory_delayed_response|{s5}
dlga_companion_recruit_backstory_delayed_response:companion_recruit_signup_b|Talvez eu possa usar você em minha companhia.
dlga_companion_recruit_backstory_delayed_response:close_window|Vou avisar você se eu ouvir algo.
dlga_companion_recruit_signup_confirm:close_window|Otimo! De alguns minutos para preparar e estarei pronto para partir.
dlga_start:companion_rehire|Minha oferta para me juntar a você continua de pé, se você precisar de mim.
dlga_start:companion_rehire.1|É otimo ver você vivo, {s5}! {s6}, e eu não sabíamos se você tinha sído capturado, ou se havia fugido. Estive procurando por você desde então. Devo me juntar à sua companhia?
dlga_start:companion_prison_break_chains|Eu vim para tirar você daqui.
dlga_companion_prison_break_chains:close_window|Graças aos céus você veio! No entanto, não vou a lugar nenhum com essas correntes em minhas pernas. Você terá que pegar como chaves com o guarda de alguma forma.
dlga_start:companion_rehire.2|{s5}
