dlga_lord_spouse_leave_faction_proclaim_queen:lord_pretalk|Embora eu não conteste sua publicação, minha esposa, gostaria que um de nós detivesse uma fortaleza que poderia servir como nossa corte antes de nos declararmos publicamente.
dlga_lord_spouse_leave_faction_proclaim_queen:lord_spouse_leave_faction_proclaim_queen_confirm|{s11}
dlga_lord_spouse_leave_faction_proclaim_queen:lord_pretalk.1|{s11}
dlga_lord_spouse_leave_faction_proclaim_queen_confirm:close_window|Já estou pronta, meu marido. Avancemos em busca do nosso trono.
dlga_lord_spouse_leave_faction_proclaim_queen_confirm:lord_pretalk|Talvez eu ainda não esteja pronto.
dlga_lord_spouse_leave_faction_husband_king:lord_pretalk.1|Talvez, mas eu precisaria fazer seu apoio total para requerer essa especificação. Gostaria de resolver a rebelião de {s4} antes de empurrar isso ainda mais.
dlga_lord_spouse_leave_faction_husband_king:lord_spouse_leave_faction_husband_king_2|A maioria das grandes famílias desta terra tem uma solicitação ao trono... Dados os problemas recentes com a sucessão, eu deveria ser um rei tão legítimo como {s4}.
dlga_lord_spouse_leave_faction_husband_king_2:lord_spouse_leave_faction_husband_king_3|Como rei, adiarei o julgamento da nomeação dos ministros, a condução da diplomacia e outros assuntos desse tipo.
dlga_lord_spouse_leave_faction_husband_king_3:close_window|Muito bem, meu marido. Deixe-nos ir adiante para pressionar sua particularidade!
dlga_lord_spouse_leave_faction_husband_king_3:lord_pretalk|Na verdade, deixe-nos, esperaremos um pouco.
dlga_lord_recruit_2_philosophy:lord_recruit_2|{s43} Deseja falar mais algo?
dlga_lord_recruit_2:lord_recruit_2_discontent|Como se sente sobre {s15}?
dlga_lord_recruit_2:lord_recruit_3_a|Lembra-se O que eu havia dito anteriormente?
dlga_lord_recruit_2:lord_recruit_quarrel_describe|Ouvi dizer que você brigou com {s16}
dlga_lord_recruit_quarrel_describe:lord_recruit_2|Não é nenhum segredo. {s14}
dlga_lord_recruit_2:lord_pretalk|Não importa.
dlga_lord_recruit_2_discontent:lord_recruit_2_discontent_b|{s12}
dlga_lord_recruit_2_discontent:lord_recruit_hesitant|{s12}
dlga_lord_recruit_2_discontent_b:lord_recruit_3|Às vezes, eu me preocupo com o estado do reino.
dlga_lord_recruit_hesitant:lord_recruit_hesitant_persuade|Não consigo convencê-lo a falar um pouco mais?
dlga_lord_recruit_hesitant:lord_pretalk|Ah. Muito bom.
dlga_lord_recruit_hesitant_persuade:lord_recruit_3|Falando assim, admito que às vezes me preocupo com o estado do reino.
dlga_lord_recruit_hesitant_persuade:lord_pretalk|Você testa minha paciência. Eu já disse que não tenho nada a declarar.
dlga_lord_recruit_3:lord_recruit_3_a|Bem, tenho algo a lhe dizer.
dlga_lord_recruit_3:lord_pretalk|Bem, é interessante saber disso. Mas já é o suficiente sobre política.
dlga_lord_recruit_3_a:lord_recruit_3_reset_claim|{s12}
dlga_lord_recruit_3_reset_claim:lord_recruit_3_claim|Sim, é isso.
dlga_lord_recruit_3_reset_claim:lord_recruit_3_a_reset|Deixe-me dizer isso de uma outra forma.
dlga_lord_recruit_3_a:lord_recruit_3_b|Sim?
dlga_lord_recruit_3_a_reset:lord_recruit_3_b|Sim?
dlga_lord_recruit_3_b:lord_recruit_3_why|Peço seu apoio para tomar o trono de Nortúmbria.
dlga_lord_recruit_3_b:lord_recruit_3_why.1|Peço que jure lealdade ao meu senhor, (s45), como monarca de toda Nortúmbria.
dlga_lord_recruit_3_b:lord_pretalk|Não importa.
dlga_lord_recruit_3_dilemma_1:lord_recruit_3_dilemma_2|{s43}
dlga_lord_recruit_3_dilemma_2:lord_recruit_3_why|{s43}
dlga_lord_recruit_3_why:lord_pretalk|Ambos temos somente uma fortaleza em nosso nome. Você seria capaz de governar a partir de um esconderijo nos bosques?
dlga_lord_recruit_3_why:lord_recruit_3_d|Por que devo apoiar {s44}?
dlga_lord_recruit_3_d:lord_recruit_3_claim|{s43}
dlga_lord_recruit_3_d:lord_recruit_3_claim.1|Se {s45} fosse {s47}, {s45} trataria todos os homens de forma justa e defenderia o direito dos plebeus.
dlga_lord_recruit_3_d:lord_recruit_3_claim.2|Se {s45} fosse {s47}, {s45} defenderia seus antigos direitos como nobre dessa terra.
dlga_lord_recruit_3_d:lord_recruit_3_claim.3|Porque {s45} pode unificar como Terras Nórdicas e por um fim a essa discórdia.
dlga_lord_recruit_3_d:lord_recruit_3_claim.4|Porque {s45} irá recompensá-lo com terras.
dlga_lord_recruit_3_d:lord_pretalk|Não importa
dlga_lord_recruit_3_claim:lord_recruit_3_claim|Você diz a cada pessoa o que você pensa que elas mais querem ouvir? {s12}
dlga_lord_recruit_3_claim:lord_recruit_4|{s12}
dlga_lord_recruit_3_claim:lord_pretalk|{s12}
dlga_lord_recruit_4:lord_recruit_4_objective_conditions|Peço que jure lealdade a {s16}.
dlga_lord_recruit_4:lord_pretalk|Não importa.
dlga_lord_recruit_4_objective_conditions:lord_recruit_5_security|Deixe-me pensar...
dlga_lord_recruit_5_security:lord_recruit_5_political|{s32}
dlga_lord_recruit_5_political:lord_recruit_5_ideological|{s31}
dlga_lord_recruit_5_ideological:lord_recruit_5_change_sides|{s33}
dlga_lord_recruit_5_change_sides:lord_recruit_6|{s34}
dlga_lord_recruit_6:lord_recruit_6_reaction|É hora de você tomar uma decisão.
dlga_lord_recruit_6:lord_pretalk|Não é preciso decidir nada no momento, podemos falar disso mais tarde.
dlga_lord_recruit_6_reaction:lord_recruit_7_decision|Muito bem...
dlga_lord_recruit_7_decision:lord_pretalk|{s12}
dlga_lord_recruit_7_decision:lord_recruit_pledge|Muito bem, estou pronto para jurar lealdade a {s4} como {reg4? minha rainha:meu rei}.
dlga_lord_recruit_pledge:lord_recruit_pledge|Lembre-se. Você me prometeu um feudo. Aguardo o cumprimento dessa promessa.
dlga_lord_recruit_pledge:lord_recruit_pledge_conclude|Que assim seja, juro lealdade como teu fiel vassalo. Estarei ao seu lado para lutar contra seus inimigos sempre que precisar de minha espada e defender suas reinvidicações e como seus legítimos herdeiros. Eu espero que, por sua vez, você me proteja e reconheça meus direitos como seu vassalo.
dlga_lord_recruit_pledge:lord_recruit_pledge_conclude.1|Que assim seja, pode informar ao {s4} que agora eu sou seu fiel vassalo e que irei {reg4? seguí-la:seguí-lo} enquanto respirar, estarei ao seu lado para lutar contra seus sempre que precisar de minha espada e defender suas reinvidicações e como de seus legítimos herdeiros. Em contrapartida, eu espero sua proteção e o reconhecimento dos meus direitos como seu vassalo.
dlga_lord_recruit_pledge_conclude:close_window|Agora... Esse é um passo importante que eu tomo. Irei me retirar, posso precisar de algum tempo para me preparar ao que vem a seguir.
dlga_lord_start:close_window.3|Recebi este presente presente através de {s11}, {s10}. Foi um gesto nobre, e me arrependo de um dia termos brigado.
dlga_lord_start:close_window.4|Recebi este presente através de {s11}, {s10}. Estou disposto à esquecer tudo o que está no passado.
dlga_lord_start:close_window.5|Recebi este presente através de {s11}, {s10}. Você acha que pode comprar minha amizade?
dlga_lord_start:close_window.6|Recebi este presente através de {s11}, {s10}. Por mais que tenha sido um belo gesto, não posso esquecer nossas diferenças.
dlga_lord_talk:denounce_lord_results|Fiz o que você sugeriu, e denunciei {s4}
dlga_denounce_lord_results:lord_pretalk|Sim, espero que agora {s4} pense duas vezes antes de confiar a ele qualquer feudo, honrarias ou serviços. Somos gratos a você.
dlga_denounce_lord_results:close_window|Exato. Ouvimos que ele o forçou a retirar suas palavras e assim emergindo deste caso parecendo mais forte que antes. Perdoe-me, {reg59?Senhora:senhor}, se a minha gratidão não é o suficiente.
dlga_lord_talk:lord_quest_intrigue_result|Fiz o que você pediu, e falei a {s5} acerca do perigo representado por {s4}.
dlga_lord_quest_intrigue_result:lord_pretalk|Nós ouvimos. Espero que, agora {s5} pense duas vezes antes de confiar a ele qualquer feudo adicional, honrarias ou serviços. Somos gratos a você.
dlga_lord_quest_intrigue_result:close_window|Nós ouvimos, mas, infelizmente, {s5} parece não ter ouvido. Ainda assim, somos gratos a você por tentar.
dlga_lord_talk:lord_lend_companion_end|Gostaria que {s14} retornasse para mim, {s65}, se você não precisar de mais de seus serviços.
dlga_lord_lend_companion_end:lord_pretalk|Você já possui muitos homens em seu exército, {playername}. No momento você não pode liderar nenhum a mais.
dlga_lord_lend_companion_end:lord_pretalk.1|Certamente, {playername}. {reg3?Ela:Ele} é {reg3?uma garota:um rapaz} brilhante, você é {reg59?uma mulher:um homem} de sorte em ter companheiros tão dignos.
dlga_lord_talk:lord_ask_to_collect_debt|Eu vim cobrar seu débito para com {s1}.
dlga_lord_ask_to_collect_debt:lord_ask_to_collect_debt_2|Oh... Bem, {s1} me emprestou algum dinheiro há um tempo, mas fiz muitos favores a ele no passado e considero o dinheiro como meu devido pagamento.
dlga_lord_ask_to_collect_debt_2:convince_begin|{s1} considera como um débito. Ele pediu para falar com você em seu nome.
dlga_lord_ask_to_collect_debt_2:lord_pretalk|Então não insistirei mais no assunto.
dlga_convince_accept:close_window|Minha dívida com {s8} muito tempo não foi paga e sendo fonte de grande desconforto para mim. Obrigado por aceitar levar o dinheiro para ele. Por favor, dê-lhe estes {reg10} veados de prata e agradeça a ele em meu nome.
dlga_lord_talk:lord_ask_to_make_peace|Por favor, {s64}, é tempo de pôr fim a esta guerra entre {s12} e {s13}.
dlga_lord_ask_to_make_peace:lord_ask_to_make_peace_2|Hã? Eu ouvi direito, {playername} ?. A guerra não é facilmente esquecida por ambos os lados do conflito e ainda tenho uma memória muito boa. Por que eu deveria ter qualquer interesse em firmar a paz com esses cães?
dlga_lord_ask_to_make_peace_2:convince_begin|Talvez eu possa falar com você sobre isso...
dlga_lord_ask_to_make_peace_2:lord_pretalk|Esqueça, por agora a paz pode esperar.
dlga_convince_accept:close_window.1|Você me convenceu, {playername}. Muito bem então, você tem a minha benção para levar uma oferta de paz ao {s14}. Eu não posso assegurar que eles a aceitarão, mas na possibilidade deles fazerem, eu a manterei.
dlga_lord_talk:lord_challenge_duel_for_lady|Quero que você se aposente suas acusações contra {s1}.
dlga_lord_challenge_duel_for_lady:lord_challenge_duel_for_lady_2|Que acusações? Todos sabem que ela se deita com os garotos dos estábulos e qualquer outro que ela possa pegar enquanto seu marido não está. Apenas repeti o que dizem muitos.
dlga_lord_challenge_duel_for_lady_2:lord_challenge_duel|Você irá retirar essas mentiras ou irá prová-las contra a minha espada!
dlga_lord_challenge_duel_for_lady_2:lord_pretalk|Se você diz...
dlga_lord_challenge_duel:close_window|{s15}
dlga_lord_talk:lord_challenge_courtship_rival|Abandone seu cortejo a {s5}!
dlga_lord_challenge_courtship_rival:lord_challenge_courtship_rival_2|Ou o que? Você pretende duelar por uma senhorita? Saiba que, nosso sóbrio desaprova esse tipo de desafio de fruto de paixões terrenas, quando todos os homens desenvolverem estar unidos contra o inimigo estrangeiro.
dlga_lord_challenge_courtship_rival_2:lord_challenge_duel|Está com medo de lutar comigo?
dlga_lord_challenge_courtship_rival_2:lord_pretalk|Me perdoe. Eu falei precipitadamente.
dlga_lord_talk:lord_message_delivered|Trago uma mensagem de {s9}.
dlga_lord_message_delivered:lord_pretalk|Oh? Deixe-me ver isso... Muito obrigado, foi bom me trazer isso, {playername}. Aqui está meu selo como prova de que recebi a mensagem, e dê meus cumprimentos a {s9} quando vê-lo novamente.
dlga_lord_talk:lord_message_delivered_enemy|Trago uma mensagem de {s9}.
dlga_lord_message_delivered_enemy:close_window|Oh? Deixe-me ver isso... Hmmm. Foi bom você me trazer isso, {playername}. Tome meu selo como prova de que recebi a mensagem, com meus agradecimenos.
dlga_lord_talk:lord_deliver_message_prisoner|Trago uma mensagem de {s11}.
dlga_lord_deliver_message_prisoner:lord_deliver_message_prisoner_2|Pode ser verdade? Ai, minha sincera gratidão, {playername}! Você trouxe esperança e um pequeno raio de luz a essas paredes sombrias. Talvez um dia seja eu capaz de recompensá-lo.
dlga_lord_deliver_message_prisoner_2:lord_deliver_message_prisoner_2a|Era o mínimo que eu podia fazer, {s65}.
dlga_lord_deliver_message_prisoner_2a:close_window|Você não tem ideia do quão grato eu sou, {playername}. Te agradeço imensamente.
dlga_lord_deliver_message_prisoner_2:lord_deliver_message_prisoner_2b|Não se preocupe, {s65}. Você terá ampla oportunidade uma vez que está livre novamente.
dlga_lord_deliver_message_prisoner_2b:close_window|Hah, mas é claro, {playername}. Leve meus eternos agradecimentos com você.
dlga_lord_talk:lord_rescue_by_replace_offer|Não tema, estou aqui para resgatá-lo.
dlga_lord_rescue_by_replace_offer:lord_rescue_by_replace_offer_2|Grande Deus, você está falando sério? Qual é o seu plano?
dlga_lord_rescue_by_replace_offer_2:lord_rescue_by_replace_offer_3|Um truque simples, {s65}. Se nós trocarmos nossas roupas, eu tomarei seu lugar aqui na prisão, enquanto você realiza sua fuga disfarçado de mim. Eu paguei aos guardas um belo suborno, com o qual tenho certeza que já compraram metade dos estoques de vinho da taberna mais próxima. Com um pouco de sorte eles ficarão tão bêbados, que conseguirá em reconhecer a própria mãe, e muito menos em dizer quem de nós é quem. Pelo menos não até que você está em uma salva.
dlga_lord_rescue_by_replace_offer_3:lord_rescue_by_replace_offer_4|Hmm, isso pode funcionar... Mas e com você, {reg59?minha senhora:meu amigo}? Os guardas não aceitarão gentilmente essa trapaça. Você pode acabar passando algum tempo nessa cela.
dlga_lord_rescue_by_replace_offer_4:lord_rescue_by_replace_offer_5a|Não se preocupe, {s65}. Já estou começando a gostar do lugar.
dlga_lord_rescue_by_replace_offer_4:lord_rescue_by_replace_offer_5b|Eu estarei bem enquanto houver ampla uma recompensa me esperando no final.
dlga_lord_rescue_by_replace_offer_5a:lord_rescue_by_replace_offer_6|Você é uma alma corajosa. Eu não me esquecerei disso.
dlga_lord_rescue_by_replace_offer_5b:lord_rescue_by_replace_offer_6|Mas é claro, {reg59?minha senhora:meu amigo}, mas é claro! Venha a mim quando recuperar sua liberdade, e talvez eu possa pagar uma dívida contigo.
dlga_lord_rescue_by_replace_offer_6:close_window|Rápido, {s65}, vamos trocar nossas roupas. Já passou da hora de você estar longe daqui.
dlga_lord_talk:lord_ask_pardon_after_oath_renounced|{s66}, desejo restaurar meu antigo juramento ao {s4}.
dlga_lord_ask_pardon_after_oath_renounced:lord_pretalk|Essa é uma questão muito grande para que eu decida, {playername}. Você deve procurar {s4}. Tal clemência é exclusivamente sua para conceder ou negar.
dlga_lord_ask_pardon_after_oath_renounced:lord_ask_pardon_terms|{s11}.
dlga_lord_ask_pardon_terms:lord_pretalk|Como quiser, {s65}. Aceitarei sua decisão.
dlga_lord_ask_pardon_terms:lord_pretalk.1|Uma vergonha, {s65}. Uma vergonha.
dlga_lord_ask_pardon_terms:lord_pretalk.2|Muito bem, vá e morra sem mim.
dlga_lord_ask_pardon_terms:lord_ask_pardon_after_renounce_peace|Sim, estou pronto.
dlga_lord_ask_pardon_terms:lord_ask_pardon_terms_rejected|Pensando bem, não. Não quero voltar a serví-lo.
dlga_lord_ask_pardon_terms:lord_ask_pardon_after_renounce_peace.1|Sim, eu concordo com esses termos.
dlga_lord_ask_pardon_terms:lord_ask_pardon_terms_rejected.1|Esse é um alto preço, {s65}. Eu devo recusar.
dlga_lord_ask_pardon_after_renounce_peace:lord_pretalk|Excelente. Embora você tenha se desejado de nós, {playername}, nossos corações se alegram em saber que encontrou um meio de voltar ao caminho certo. Eu restauro aqui sua homenagem a mim. Levante uma vez mais como {reg59?Uma honrada guerreira:um honrado homem} ao meu serviço.
dlga_lord_ask_pardon_terms_rejected:close_window|Então saia da minha vista, traidor! Saia daqui e não volte!
dlga_lord_talk:lord_ask_pardon|Desejo fazer as pazes com o {s4}.
dlga_lord_ask_pardon:lord_pretalk|De fato, {playername}? Então vá e tropece na sua espada. Dê-nos toda a paz.
dlga_lord_ask_pardon:lord_pretalk.1|{playername}, você é {reg59?uma lady:um lorde} sem mestre, segurando terras em seu nome, com apenas um trapo de uma reinvidicação de legitimidade. Nenhum rei das Terras Nórdicas aceitaria uma paz duradoura com você.
dlga_lord_ask_pardon:lord_pretalk.2|Fazer a paz quando eu tenho vantagem sobre você? Eu penso que não.
dlga_lord_ask_pardon:lord_pretalk.3|Fazer a paz não está em meu atual nível de interesse.
dlga_lord_ask_pardon:lord_truce_offer|Sim, estou cansado de lutar contra você. Posso oferecer-lhe uma trégua se manter sua palavra de não molestar minhas terras e assuntos, podemos conversar novamente.
dlga_lord_truce_offer:close_window|Eu aceito. Vamos parar de guerrear um com o outro, pelo tempo que for.
dlga_lord_truce_offer:lord_pretalk|Pensando bem, tal acordo não está em meu interesse.
dlga_lord_ask_pardon:lord_ask_pardon_2|Hmm. Eu poderia usar minha ampliação para ajustar para um perdão para você, {playername}, mas alguns que o considerar um inimigo e não ficarão comparar a menos que você pague um tributo. Fazendo as contas, você precisa trazer não menos que {reg16} veados de prata para fazer amigos no {s4}.
dlga_lord_ask_pardon:lord_pretalk.4|Eu não estou em posição de lhe oferecer nada. Você deve falar com {s7}.
dlga_lord_ask_pardon:lord_ask_pardon_2.1|Sim, tenho maiores preocupações que você ou seus seguidores. No entanto, você tem injustiçado meus súditos, e injustiças compensação compensação. Pela soma de {reg16} veados de prata, suponho que poderia concordar em conceder-lhe perdão. O que você diz?
dlga_lord_ask_pardon:lord_pretalk.5|Me desculpe. Eu não estou em posição de lhe oferecer um perdão.
dlga_lord_ask_pardon_2:lord_ask_pardon_tribue_accept|Eu tenho o dinheiro aqui. {reg16} veados de prata.
dlga_lord_ask_pardon_2:lord_ask_pardon_tribue_deny|Temo que eu não posso pagar tanto.
dlga_lord_ask_pardon_tribue_accept:close_window|Excelente, {playername}. Usarei esse dinheiro para remendar sua situação com aqueles que você injustiçou e eu deixarei saberem que você não é mais um inimigo do {s4}.
dlga_lord_ask_pardon_tribue_accept:close_window.1|Excelente, {playername}. Usarei esse dinheiro para suavizar os ânimos que podem se opor ao seu perdão e estou certo de que todos saberão que você não é mais um inimigo do {s4}.
dlga_lord_ask_pardon_tribue_deny:lord_pretalk|Então não há nada que eu possa fazer por você, {playername}. Se não há prata, não há perdão.
dlga_lord_talk:lord_active_mission_1|Sobre a tarefa que você me encarregou...
dlga_lord_talk:lord_switch_to_spouse|Vamos discutir sobre assuntos domésticos.
dlga_lord_switch_to_spouse:lord_pretalk|Vamos esperar até que estejamos em um castelo, minha esposa. É difícil discutir inventários e tais questões em campo.
dlga_lord_switch_to_spouse:spouse_talk|Certamente, minha esposa.
dlga_lord_talk:lord_start_quest1|Bom dia, Vossa Graça, tenho algumas notícias importantes que você pode estar interessado em ouvir.
dlga_lord_start_quest1:lord_start_quest_11|Estou ouvindo.
dlga_lord_start_quest_11:lord_start_quest_21|(Você entrega a carta que encontrou)
dlga_lord_start_quest_21:close_window|De fato interessante, embora esperado. {playername}, veja você mesmo. Parece que tenho trabalho a fazer.
dlga_lord_talk:lord_start_quest2|Meu Senhor, tenho algumas... notícias delicadas que trago à sua atenção.
dlga_lord_start_quest2:lord_start_quest_12|Continue...
dlga_lord_start_quest_12:lord_start_quest_22|Capturamos um corvo que passava. A carta que ele carregava exibia o selo do Mão do Rei. (Você entrega a carta)
dlga_lord_start_quest_22:close_window|Hmm. Então é isso que ele pensa, eh. {playername}, acredito que nenhuma das palavras escritas aqui jamais passará pelos seus lábios. Claro, um Lannister sempre paga suas dívidas, aqui está um saco de moedas pelo seu trabalho.
dlga_lord_talk:lord_start_quest|Sua Graça, tenho notícias urgentes que precisam de sua atenção!
dlga_lord_start_quest:lord_start_quest_1|Por favor, continue.
dlga_lord_start_quest_1:lord_start_quest_2|Viajei de Porto Real com dois de seus soldados leais. Estou aqui para lhe dizer que o Senhor seu Pai, Eddard Stark, foi levado sob a custódia dos Lannister por motivos de alta traição.
dlga_lord_start_quest_2:lord_start_quest_3|Agradeço sua lealdade nestes tempos de desespero, {playername}, embora a notícia já tenha chegado até nós. Espero que você se junte a nós quando marcharmos para o sul sobre Porto Real. Veremos se Lorde Tywin realmente caga ouro.
dlga_lord_start_quest_3:lord_start_quest_4|Agora, {playername}. Se vou para a guerra no sul, tenho um pequeno problema que precisa ser resolvido, e para o qual peço sua ajuda.
dlga_lord_start_quest_4:lord_start_quest_yes|Claro, estou dispost{o/a} e, espero, capaz. O que você quer que eu faça, Sua Graça?
dlga_lord_start_quest_4:lord_start_quest_no|Desculpe, não tenho tempo para entregar recados para você, Sua Graça.
dlga_lord_start_quest_yes:lord_start_quest_yes2|Alguma escória selvagem conseguiu atravessar a Muralha, e meus batedores relataram que eles atacaram uma pequena fazenda ao norte daqui. Preciso lidar com eles rapidamente antes que possam causar mais estragos entre meus camponeses. Meus porta-estandartes precisam se preparar para nossa marcha para o sul, então conto com você, {playername}, para agir em meu nome neste assunto.
dlga_lord_start_quest_yes2:close_window|Sugiro que durma um pouco antes de ir. Também é aconselhável viajar com um guarda-costas ou dois: Westeros é um lugar perigoso para se viajar sozinh{o/a}.
dlga_lord_start_quest_no:close_window|Tudo bem então. Você se adapta a si mesmo.
dlga_lord_talk:lord_starting_quest2_succeed|Vossa Graça, despachei os invasores selvagens e protegi os fazendeiros com sucesso.
dlga_lord_starting_quest2_succeed:lord_starting_quest2_succeed2|Excelentes notícias. Aqui estão algumas moedas por seus esforços.
dlga_lord_starting_quest2_succeed2:lord_starting_quest2_succeed3|Há uma outra coisa, Sua Graça. Falei com um invasor selvagem antes de morrer. Ele estava... apavorado, como se estivesse fugindo de alguma coisa. Ele me implorou para queimar seu corpo depois que ele morresse.
dlga_lord_starting_quest2_succeed3:lord_starting_quest2_succeed4|Esses selvagens são um povo supersticioso. Algo mais foi mencionado?
dlga_lord_starting_quest2_succeed4:lord_starting_quest2_succeed5|Só que o inverno está chegando, e junto com ele a morte. Ele também murmurou algo sobre os Caminhantes Brancos.
dlga_lord_starting_quest2_succeed5:lord_starting_quest2_succeed6|Parecem mais histórias de Old Nans. Vá para Castle Black, encontre o Lord Commander e veja se ele pode lançar alguma luz sobre a situação. Oh, e dê a ele este pergaminho.
dlga_lord_starting_quest2_succeed6:lord_talk|Sim, Vossa Graça, partirei assim que estiver pronto.
dlga_lord_talk:lord_starting_quest2_fail|Vossa Graça, eram muitos. Os fazendeiros, crianças, mulheres... estão todos mortos. Receio ter falhado com você.
dlga_lord_starting_quest2_fail:lord_starting_quest2_fail2|Então fui muito rápido em presumir que você era um líder capaz. Não preciso mais de você e de suas falhas, {playername}.
dlga_lord_starting_quest2_fail2:lord_starting_quest2_fail3|Sinto muito, Sua Graça. Não vai acontecer de novo. Permita-me a chance de me redimir e restaurar sua fé em mim.
dlga_lord_starting_quest2_fail3:lord_starting_quest2_fail4|Muito bem, {playername}, mas se você falhar novamente, não estaremos falando em termos tão favoráveis. Espero ter deixado isso bem claro!
dlga_lord_starting_quest2_fail4:lord_starting_quest2_fail5|Claro, Sua Graça. Não vou falhar com você novamente.
dlga_lord_starting_quest2_fail5:lord_starting_quest2_fail6|Recebemos um corvo da Parede ontem. Parece que os irmãos negros precisam de mais homens por um motivo ou outro. Vá para a parede e encontre o Lorde Comandante e veja se ele pode lançar alguma luz sobre a situação. Oh, e dê a ele este pergaminho.
dlga_lord_starting_quest2_fail6:lord_talk|Sim, Sua Graça. Vou embora assim que estiver pronto.
dlga_lord_talk:lord_btb_quest|Vossa Graça, recebi ordens do Senhor Comandante da Patrulha da Noite para solicitar mais homens para a parede.
dlga_lord_btb_quest:lord_btb_quest2|Lamento, mas não temos homens sobrando. Estamos em guerra e todos os meus homens estão presos. Diga ao Senhor Comandante que lamento humildemente não poder ajudar.
dlga_lord_btb_quest2:lord_btb_quest3|A situação parecia muito terrível, meu senhor. Tem certeza de que não há nada que você possa fazer?
dlga_lord_btb_quest3:lord_btb_quest4|Assim que a guerra terminar, posso enviar homens para ajudar na muralha, mas até lá meus homens estão engajados de outra forma.
dlga_lord_btb_quest4:close_window|Muito bem, excelência, vou transmitir a mensagem com pesar.
dlga_lord_talk:lord_10_bridge_of_skulls|Meu Senhor, tenho notícias terríveis. Não fomos capazes de repelir o ataque na ponte.
dlga_lord_10_bridge_of_skulls:lord_10_bridge_of_skulls1|Droga {menino/menina}! Você deve retornar ao Rei do Norte imediatamente e dizer a ele que preciso de mais homens!
dlga_lord_10_bridge_of_skulls1:close_window|Claro, meu Senhor. Vou sair imediatamente.
dlga_lord_talk:lord_10_bridge_of_skulls_s|Meu Senhor, Repelimos o ataque à ponte. Isso deve segurá-los por um tempo.
dlga_lord_10_bridge_of_skulls_s:lord_10_bridge_of_skulls_s1|Muito bom {playername}. Agora você deve descansar um pouco, deve estar exausto. Assim que estiver pronto, você deve retornar ao Rei do Norte e dizer a ele que preciso de mais homens. Temo que a Muralha não agüente muito mais.
dlga_lord_10_bridge_of_skulls_s1:close_window|Claro, meu Senhor. Vou sair imediatamente.
dlga_lord_talk:lord_10_starting_quest|Meu Senhor, fui enviado a pedido do Rei Robb Stark. Ele me pediu para entregar esta mensagem.
